{
  "$schema": "http://json-schema.org/draft-07/schema#",
  "title": "Personal AI Teacher Knowledge Concept",
  "type": "object",
  "required": [
    "id",
    "subject",
    "grade",
    "topic",
    "learning_objectives",
    "prerequisites",
    "core_concepts",
    "definitions",
    "rules",
    "common_confusions",
    "teaching_notes"
  ],
  "properties": {
    "id": {
      "type": "string",
      "minLength": 1
    },
    "subject": {
      "type": "string",
      "minLength": 1
    },
    "grade": {
      "type": "string",
      "pattern": "^[0-9]+$"
    },
    "topic": {
      "type": "string",
      "minLength": 1
    },
    "learning_objectives": {
      "type": "array",
      "minItems": 1,
      "items": {
        "type": "string",
        "minLength": 1
      }
    },
    "prerequisites": {
      "type": "array",
      "items": {
        "type": "string",
        "minLength": 1
      }
    },
    "core_concepts": {
      "type": "array",
      "minItems": 1,
      "items": {
        "type": "string",
        "minLength": 1
      }
    },
    "definitions": {
      "type": "array",
      "minItems": 1,
      "items": {
        "type": "object",
        "required": [
          "term",
          "definition"
        ],
        "properties": {
          "term": {
            "type": "string",
            "minLength": 1
          },
          "definition": {
            "type": "string",
            "minLength": 1
          }
        }
      }
    },
    "rules": {
      "type": "array",
      "minItems": 1,
      "items": {
        "type": "string",
        "minLength": 1
      }
    },
    "common_confusions": {
      "type": "array",
      "items": {
        "type": "string",
        "minLength": 1
      }
    },
    "teaching_notes": {
      "type": "array",
      "items": {
        "type": "string",
        "minLength": 1
      }
    }
  }
}